No;Review
62;"Daun yang jatuh tak akan membenci angin

Aku bukan daun! Dan aku tak pernah mau menjadi daun!

Aku mencintainya, itulah semua perasaanku.

Dan dia jelas-jelas bukan angin

Tere liye benar-benar hebat. Terlepas dari begitu panjang dan kontroversial judul yang dia berikan, buku ini memang hebat. Mengapa kontroversial? Baca saja! Apa daun pernah berbicara tentang dia yang membenci sesuatu yang menerbangkannya, angin? Apa daun cukup mampu untuk melakukan kegiatan curhat dengan Tere Liye atau siapapun tentang siapa yang dia sukai dan tidak? Tapi bagaimanapun, judulnya memang menarik dan langsung memberi kalimat tanya : What the hell the meaning is?

Tak cukup sampai di sini, gaya penulisan Tere Liye lagi-lagi memesona. Buku ini dikisahkan dalam satu hari, sejak pukul 20.00 sampai pukul 09.00. Keren. Unik. Saya menyebutnya one-day book. Juga, latar dalam buku ini adalah toko buku. Kurang keren apa? Toko buku selalu menjadi tempat meneduhkan. Apa lagi, kalau memang toko buku menjadi salah satu tempat yang penuh dengan kenangan.

***

Pernahkah kamu menyukai seseorang, bertahun-tahun, bahkan lebih dari sepuluh tahun? Pernahkah kamu menyukai seseorang, oom yang usianya terpaut lebih dari sepuluh tahun? Pernahkah kamu menyukai seseorang, tetapi dia menganggapmu hanya sebatas adik, tidak lebih?

Dulu Anne pernah bilang, orang yang memendam perasaan sering kali terjebak oleh hatinya sendiri. Sibuk merangkai semua kejadian di sekitarnya untuk membenarkan hatinya berharap. Sibuk menghubungkan banyak hal agar hatinya senang menimbun mimpi. Sehingga suatu ketika dia tidak tau lagi mana simpul yang nyata dan mana simpul yang dusta.

Tania did. Begini ceritanya, Tania (dulunya) hanya seorang gadis sangat kecil dengan rambut dikepang dua, berpita merah. Sepeninggal ayahnya, dia tinggal di sebuah rumah kardus bersama Dede (adiknya) dan ibunya yang sakit-sakitan. Tania dan Dede, selama itu pula harus mencari uang, mengamen, di mana pun. Suatu ketika di terminal, lain waktu di bis kota.

Semuanya perlahan berubah menjadi baik sejak pertemuan dengan seorang pria paruh baya, Danar Danar. Pertemuan di bis kota yang cukup mengerikan, mulai tampil sebagai pahlawan yang membantu meringankan luka Tania sehabis menginjak paku. Romantis, bahkan sangat nampak sebagai adegan kakak-adik

Semuanya baik-baik saja, sebelum Tania sadar tentang perasaannya. Dia masih sangat belia, tapi cemburu tetap muncul ketika melihat dia (Danar) sangat dekat dengan teman perempuannya, Ratna. Semuanya kembali menjadi buruk, ketika ibu Tania meninggal setelah berjuang selama beberapa bulan melewati kanker paru-paru stadium akhir.

Untung saja, Danar selalu ada. Sebagai kakak, sebagai ayah, sebagai ibu , sebagai guru, sebagai teman dekat, dia selalu ada. Tania tumbuh menjadi gadis yang sangat cerdas. Dia sukses mendapatkan beasiswa untuk bersekolah di Singapura dalam program siswa berprestasi ASEAN. Hingga kuliah, dia pun masih di Singapura, National University of Singapore. Selepas kuliah, dia bekerja di perusahaan pialang terbesar se-Asia Pasifik, dan masih di Singapura.

Ada yang membuatnya takut untuk pulang. Kenyataan bahwa dia-nya telah menikah, bukan dengannya. Padahal sebelum menentukan pilihannya dengan Ratna, Tania sudah lebih tinggi daripada Ratna. Tania sudah lebih cerdas daripada Ratna. Apa yang membuat dia masih memilih Ratna daripada Tania? Tak ada yang tahu pasti.

Sebuah misteri tentang potongan lego harus dipecahkan sendiri oleh Tania. Dua tahun sejak pernikahan Danar dan Ratna, Tania menerima rangkaian e-mail curhatan dari Ratna. Danar berubah. Tania harus pulang. Akhirnya, Tania memutuskan untuk terbang ke Jakarta untuk mencari tahu teka-teki apa yang sebenarnya terjadi. Bahkan Dede, -adiknya yang sebenarnya tahu segalanya enggan bercerita jujur. Ada apa?

Kalian penasaran? Baca sendiri!

***

Memang, ceritanya kedengaran klise, nyaris sama dengan sinetron murahan milik beberapa rumah produksi di Indonesia. Tapi, Tere Liye dengan bahasanya yang sederhana namun apik sangat mempengaruhi saya untuk membaca, larut dalam kesedihan yang terkuak pada akhirnya. Ya, bocorannya adalah buku ini berakhir dengan buruk, menurut saya.

Penokohan yang ditampilkan oleh Tere Liye juga manusiawi. Tania, dengan segala kelebihannya, dia menampilkan kepribadian yang paradoks. Baik, tapi jahat. Danar menjadi alasan kenapa dia bersikap dingin dengan setiap laki-laki yang mencoba dekat dengannya. Juga, Danar yang sangat bijaksana dengan wajah yang memberikan kebahagiaan bagi siapapun yang bersamanya, ternyata tak cukup berani untuk jujur dengan perasaannya sendiri. Saya berani bertaruh, dia termasuk dalam daftar big three lelaki terbodoh di dunia. Mungkin setelah Adolf Hitler dan Abu Nawas.

Buku ini memiliki cerita yang sebenarnya susah ditebak. Akhir cerita yang sangat mengecewakan terlalu mengejutkan hati, membuat saya harus mengurut dada karena beberapa adegan yang terlalu melukai perasaan.

***

Daun yang jatuh tak pernak membenci angin. Dia membiarkan dirinya jatuh begitu saja. Tak melawan. Mengikhlaskan semuanya. 



""Bahwa hidup harus menerima, penerimaan yang indah. Bahwa hidup harus mengerti, pengertian yang benar. Bahwa hidup harus memahami, pemahaman yang tulus.Tak peduli lewat apa penerimaan, pengertian, pemahaman itu datang. Tak masalah meski lewat kejadian yang sedih dan menyakitkan. Biarkan dia jatuh sebagaimana mestinya. Biarkan angin merengkuhnya, membawa pergi entah kemana. (Tere Liye, Daun yang Jatuh Tak Pernah Membenci Angin)"
63;Bagus, menarik juga buat ukuran orang yang belinya randomly begitu. Tokohnya walaupun kurang srek tetapi gapapa, saya suka. Saya butuh hampir beberapa minggu untuk menuntaskan novel ini karena deadline tugas yang sudah di depan mata, pun novel ini hanyut banget dalam latar suasana yang sedih. Takut saya bacanya pas sudah setengah membaca. Tapi, after all saya kasih 3 saja, sebenarnya mau 3,5 tapi gak ada. Sukses selalu Tere Liye:)
64;"""Orang yang memendam perasaan seringkali terjebak oleh hatinya sendiri. Sibuk merangkai semua kejadian di sekitarnya untuk membenarkan hatinya berharap. Sibuk menghubungkan banyak hal agar hatinya senang menimbun mimpi. Sehingga suatu ketika dia tidak tahu lagi mana simpul yang nyata dan mana simpul yang dusta.""

Pertama kali liat buku ini dan baca sinopsisnya, udah yakin kalo buku ini bakalan bikin saya nangis. Setelah sekian lama nahan-nahan untuk beli buku ini, akhirnya kesampean juga baca karena dapet tugas dari sekolah. Dan saya nyesel kenapa baru sekarang saya baca buku ini. Buku ini bagus banget. Saya suka jalan ceritanya, perjuangan Tania, semua kebaikan Danar, sampe ending yg bikin saya geregetan. Berharap akhir yang bahagia tapi saya juga bukan pembaca yang benci dengan akhir yang menyedihkan."
65;Tertarik pengen baca buku ini karna judulnya yg unik, walau sempat ragu karena dari sinopsisnya ceritanya pasti mudah ketebak. Ya, alur ceritanya memang bisa saya terka, tapi inti ceritanya di luar dugaan! Gaya penulisannya pun luar biasa, dan endingnya ngeselin karna ngegantung, hahaa, keren deh Tere Liye :D
67;Novel yang sangat cantik, sekaligus mengharukan! Aku jatuh cinta dengan karakter Tania, apalagi dengan nama bebekpeking itu haha, pas aku baca itu, pecah sudah tawaku .. Keren, kata-katanya juga sangat simpel tapi cantik!!
71;"Baper maksimal. 
Suka sih sm cara berceritanya yg pake alur campur. Cuma klimaksnya aja, faktor pemicunya ga kuat. Krn dengan klimaks kyk gitu harusnya ada faktor pemicunya (yg bener2 kuat)."
72;selalu suka dengan semua karya tere liye yang aku baca termasuk ini!!!
74;cerita yang bagus dengan ending yang bagus
75;bagus..alur ceritanya dekat dengan kehidupan..tapi akhirnya kurang puas
80;Terbaik. Ga pernah bosen baca novel ini berkali kali, alur cerita yg ga bisa ditebak. Suka sekali dengan sosok Tania :)
83;"Daun yang Jatuh Tak Pernah Membenci Angin. Wah, membaca judulnya saja sudah terasa kental akan sisi memaafkan, keikhlasan, dan... penerimaan. Benar begitu bukan? Hehehe. Tapi setelah saya selesai membaca novel setebal 264 halaman ini, ada begitu banyak hal lainnya yang bisa ditangkap. Cie, tangkap. Emangnya bola kasti. Haha abaikan. 

Selain bla bla bla yang saya sebut di atas ada juga hal menarik lain seperti, tentang kerja keras, kekeluargaan, berbagi, rahasia nama pena atau tulis menulis. Yap! Tokohnya adalah seorang penulis. Dan masih banyak lagi.
Lebih lengkapnya baca sendiri ya! :p

Ini adalah novel ke sekian karya Tere Liye yang saya baca. Seperti novel lain yang sudah-sudah, buku ini membuat saya terhenyak serta banyak berpikir lama. Termenung lama. Dan jatuh hati. Selalu.

Cerita dimulai dengan tokoh utama bernama Tania, remaja berusia sebelas tahun yang hidup miskin. Tinggal bersama adik laki-laki dan ibunya di rumah kardus dekat sungai pembuangan. Ayahnya meninggal sejak Tania delapan tahun. Sementara sang ibu sakit-sakitan. Sehari-hari Tania dan Dede--adiknya--mengamen dari satu bis ke bis lain untuk bertahan hidup. Sampai akhirnya ia bertemu dengan Om Danar.

Sejak pertemuan itu hidup Tania berubah. Dia mulai sekolah, segala kebutuhan dicukupi oleh Om Danar. Baik makanan juga tempat tinggal. Ada setitik harapan hidup yang lebih baik. Tania dan Dede adalah anak yang cerdas. Mereka bisa mengejar pendidikan dengan kemampuan dan kemauan yang tinggi. Malahan Tania mendapat beasiswa pendidikan SMA di Singapura.

Tapi sebelum keberangkatan, ibu Tania sakit keras, kanker paru-paru stadium IV. Membuat Tania bimbang memutuskan pergi atau tidak. Tak lama hal menyakitkan itu beneran datang. 

Benar-benar sedih membaca bagian ini. 

Hiks!

Bagaimana tidak sedih, jika melihat ibu kita meninggal?

Huhuhu.

Di sinilah Tere Liye mengajarkan keikhlasan. Nasihat itu datang dari ucapan Om Danar.

""Bahwa hidup harus menerima. Penerimaan yang indah. Bahwa hidup harus mengerti. Pengertian yang benar. Bahwa hidup harus memahami. Pemahaman yang tulus. Tak peduli lewat apa penerimaan, pengertian, dan pemahaman itu datang. Tak masalah meski lewat kejadian yang sedih dan menyakitkan. Seperti Daun yang jatuh tak pernah membenci angin. Dia membiarkan dirinya jatuh begitu saja. Tak melawan. Mengikhlaskan semuanya

Sedih banget, nget. 

Tidak berhenti sampai di sini, kisah Tania terus berlanjut. Bulir-bulir cinta mulai tumbuh terhadap Om Danar. Tapi bagaimana dengan Om Danar sendiri. Belum jelas apakah ia juga mencintai Tania. Pertanyaan ini terus menggerus perasaan Tania. 

Di bagian akhir ada satu bagian yang sangat saya suka. 

Dia (Om Danar) memang sempurna, tapi dia tidak sempurna. 

Well, memang beginilah kenyataan hidup. Tidak ada manusia yang sempurna. Semenarik apa pun seseorang itu, ia tetap mempunyai sisi buruknya. Sekarang mengkin belum terlihat. Cepat atau lambat kenyataan itu harus kita terima. Perlu banyak ilmu untuk menyikapi kekurangan ini. 

Well, akhirnya selesai juga me-review-nya. Buku ini terbit pertama kali tahun 2010, sementara sekarang sudah tahun 2016. 

Wow!

Enam belas tahun yang lalu! Apakah terlalu terlambat?

Mungkin. 

Tapi tidak bagi yang belum membacanya. Buku ini tetap menarik kok. Tetap segar. Tidak ketinggalan jaman. Terbukti saat beberapa waktu lalu--masih di tahun 2016--saat saya berkunjung ke rumah teman. Sebut saja namanya Mr. M. Ketika itu dia membongkar saya punya tas. Mr. M langsung nyeletuk, ""Ini apa? Ih ini buku keren banget. Baru kali ini aku lihat ada buku dengan judul sebagus ini. Pinjem dong."" Padahal seumur-umur saya mengenalnya. Mr M ini sangat tidak suka membaca buku. Hahaha.

Tak lama setelah kejadian itu, entah profil FB, BBM, atau medsos lain. Digonta-gantinya dengan gambar DYJTPMA.

Sekian.
Terima kasih."
84;Salah satu novel dengan pembahasaan yang unik dari Tere Liye. Dan menurutku alur ceritanya cukup bikin penasaran.
85;"Banyak hal yang tidak akan terduga terjadi kapan, di mana, pada siapa dan oleh siapa saja. Satu dari sekian banyak fase kehidupan yang enggan manusia hindari adalah kehilangan. Padahal sesuatu (orang) yang dicintai bisa hilang dari kehidupan walaupun begitu banyak kenangan yang tidak dapat dilupakan. Mungkin berat menerima kehilangan, namun karena tidak ada jalan selain penerimaan yang baik, pengertian yang baik dan pemahaman yang baik, maka mau-tidak mau ketiga hal tersebut harus dijalani. Itulah daun yang tak pernah membenci angin
Lika-liku kehidupan Tania seperti daun yang terbawa angin. Perjalanan hidup menjadi seorang anak jalanan (pengamen)telah menjadi batu loncatan bagi kehidupan berikutnya. Tidak mungkin dia, anak gadis 11 tahun, memilih menjadi seorang anak yatim yang tinggal di rumah kardus bersama adiknya laki-laki kalau takdir tidak menghendakinya .
Keseharian menjadi pengamen bus kota ia lakoni seperti biasa bersama adik laki-lakinya. Tak ada yang menyuruhnya untuk menjadi pengamen. Namun Tania mengerti bahwa dia harus membantu ibunya. Suatu hari seorang preman mabuk meminta uang hasil mengamen dan mengancam keselamatan mereka, melihat adiknya dicekik sampai pucat pasi tidak ada jalan lain uang hasil jerih payah dia relakan untuk preman itu. Akhirnya ia pulang malam untuk mengganti uang yang tadi ia berikan pada preman dengan mengamen di bus.Dipertemukan dengan Danar, seorang pemuda berusia 23 tahun garagara sebuah paku payung yang tertancap di Kaki Tania. Itulah awal mula Danar menjadi penolong bagi keluarga Tania hingga sering bertemu di bus setiap hari. Maka terjalin komunikasi antara mereka.
Sejak mengetahui kondisi perekonomian keluarga Tania, interaksi antara Danar dan keluarga Tania begitu kerap. Hingga akhirnya Danar lah yang menyuruh (membiayai) Tania serta Adiknya (Dede) melanjutkan sekolahnya. Kehidupan mereka dari waktu demi waktu mulai membaik. Danar, yang sudah dianggap sebagai malaikat penolong begitu sayang kepada keluarga Tania. Bahkan ibu Tania sudah menganggap anak Pada Danar. Terlebih kasih sayangnya sebagai kakak, sahabat dan orang tua Ia curahkan selepas ibu Tania meninggal dunia. Namun satu hal yang mengganjal di hati Tania tentang perasaannya yang tak bisa ia pungkas dan tak berani untuk mengungkapkan dengan jujur pada Danar. Sebuah perasaan yang tidak seperti adik kepada Kakaknya. Dan Tania biarkan begitu saja perasaan itu ia pupuk. Hingga akhirnya Danar menikah dengan pilihannya yang akhirnya banyak terungkap teka-teki Danar.
Hidup itu harus menerima, penerimaan yang indah. Bahwa hidup itu harus mengerti, pengertian yang benar. Bahwa hidup itu harus memahami, pemahaman yang tulus. Tak peduli lewat apa penerimaan, pengertian, pemahaman itu datang. Tak masalah meski lewat kejadian yang sedih dan menyakitkan (halaman 196). 
Novel ini tak kalah inspiratif dengan karya Tere-Liye sebelumnya. Kisah yang dituangkan dalam novel ini menyadarkan bahwa antara cinta dan kehilangan selalu ada dalam kehidupan. Bukan hanya cinta antara lawan jenis atau kerabat. Namun semua yang bersangkut paut dengan cinta. Dengan novel ini pembaca diajak untuk bangkit dari kesedihan yang berlarut. Menjadikan energi kesedihan sebagai energi untuk terus menerus berbuat kebaikan. 
Karena, kata Tere-Liye, kebaikan itu seperti pesawat terbang. Jendela-jendela bergetar, layar TV bergoyang, telepon genggam terinduksi saat pesawat lewat. Kebaikan merambat tanpa mengenal batas. Bagai garpu tala yang berisonansi. Kebaikan itu menyebar dengan cepat (halaman 184). "
87;"Tania dan Dede, adalah sepasang kakak beradik yang sehari-harinya bekerja sebagai pengamen jalanan. Suatu hari, saat sedang mengamen di sebuah bis pada kepulangan mereka ke rumah, Tania dan Dede bertemu dengan seorang lelaki yang kemudian menjadi malaikat dalam kehidupan mereka. Laki-laki itu bernama Danar. Malam itu dia menolong Tania yang kakinya tertusuk paku payung. Dan seterusnya, dialah penopang kehidupan Tania, Dede dan ibunya. Pertemuan dengan Danar juga mengajarkan Tania sebuah perasaan baru. Tania yang saat itu berusia 11 tahun tanpa sadar sudah jatuh cinta pada malaikatnya.

Hari-hari setelah kehadiran Danar merupakan sebuah awal yang baru dalam kehidupan Tania. Dia dan adiknya bisa bersekolah kembali, mereka bisa tinggal di tempat tinggal yang lebih layak, dan ibunya bisa memulai usaha yang dulu diidam-idamkannya. Sayangnya kebahagiaan itu harus ternoda. Dua tahun berselang, ibu Tania meninggal dunia. Tania dan Dede resmi menjadi yatim piatu. Disinilah kembali Danar menjelma menjadi malaikat bagi Tania dan Dede. Sepeninggal ibunya, Tania dan Dede diboyong ke kontrakannya.

Waktu terus berjalan. Tania yang cerdas berhasil mendapat beasiswa untuk bersekolah di Singapura. Bertahun-tahun terpisah nyatanya tak membuat perasaan Tania kepada Danar menghilang begitu saja. Malah seiring dengan pertumbuhannya perasaan itu semakin membesar. Tania yang tumbuh menjadi seorang gadis cantik dan dia pun merasa pantas untuk mendampingi Danar. Baginya rentang usia 14 tahun bukanlah masalah.

Sayangnya cinta itu tak pernah tersampaikan. Danar memutuskan menikah. Tania pun larut dalam upaya menghilangkan kesedihan. Bekerja tanpa henti. Berubah menjadi pribadi yang berbeda. Hingga akhirnya rahasia itu mulai terungkap.

*****

Untuk urusan bercerita, Tere Liye memang tak perlu diragukan lagi. Sudut pandang yang digunakan adalah sudut pandang orang pertama, dengan Tania sebagai tokoh utamanya. Alur cerita dibuat secara flashback untuk setiap bab-nya. Sedang untuk editing, saya menemukan satu kesalahan pengetikan nama Tania menjadi Ratna. Lalu karena dalam novel ini Tania selalu menyebut nama Danar dengan dia maka kadang saya harus benar-benar cermat dalam kalimat demi kalimat dalam novel ini. Penggunaan panggilan dia ini juga kalau menurut saya berpotensi menimbulkan rasa bosan bagi pembaca, mengingat betapa seringnya Tania menyebutkan kata dia dalam upayanya mengurai kenangan.

Secara keseluruhan, novel ini cukup menarik untuk dibaca. Dan seperti biasa, Tere Liye selalu menyisakan pertanyaan di akhir novel-novel yang dibuatnya. Apalah kalimat yang dibisikkan Danar di telinga Tania pada saat itu?"
88;"Daun yang jatuh tidak pernah membenci angin, berkisah tentang kenangan dan cinta yang dialami oleh seorang gadis cantik dan pintar bernama Tania. Seperti sebuah lego yang disusun satu persatu hingga menjadi utuh, kisah dalam novel yang ditulis oleh Tere Liye ini sanggup menghanyutkan hati pembaca pada setiap potongan ceritanya.

Ketika berumur 11 tahun, kerasnya kehidupan membuat Tania dan Dedeadik Taniaterpaksa mencari uang dengan mengamen dari satu bus kota ke bus yang lainnya, hal tersebut mereka lakukan demi menghidupi diri mereka dan sang ibu yang sakit-sakitan. Ayah Tania meninggal ketika Tania berumur 8 tahun. Sejak saat itu pula kehidupan mereka yang pas-pasan berbalik menjadi serba kekurangan. Tania, Dede, dan Ibunya diusir dari rumah kontrakan lalu memutuskan untuk tinggal di rumah kardus dekat dengan sungai dan tempat pembuangan.

Ketika Tania dan Dede sedang mengamen, tanpa sengaja Tania menginjak sebuah paku payung pada telapak kaki tanpa alasnya. Tania kecil mencoba menahan rasa sakit sementara adiknya hanya bisa panik tanpa tahu harus melakukan apa. Orang-orang dalam bus hanya melirik Tania yang kesakitan tanpa rasa iba. Ketika itulah, seorang pria muda datang menolong dan membalut kaki Tania dengan sapu tangan putih miliknya.

Pria itu bernama Danar, malaikat yang dikirimkan Tuhan untuk merubah kehidupan Tania, Dede, dan Ibunya. Pria yang membuka babak baru yang lebih baik dalam kehidupan Tania, juga menjadi cinta pertama baginya.

Sudut pandang orang pertama yang digunakan oleh Tere Liye dalam novel ini membuat emosi dan penyampaian melalui sudut pandang Tania menjadi cukup baik dan dapat dinikmati pembaca. Alur maju-mundur yang penulis ingin coba sampaikan dalam bercerita sama sekali tidak membingungkan pembaca. Sang penulis sangat baik dalam merangkai sebuah cerita hingga menemukan benang merahnya.

Walau ini adalah kali pertama saya membaca novel karya Tere Liye, nampaknya saya mulai jatuh cinta dengan gaya penulisan yang sederhana namun bermakna khas beliau. Saya cukup menikmati cerita dalam novel ini dari awal hingga akhir cerita, walau saya merasa cerita dalam novel ini cukup klise dan masih tergolong mudah ditebak bagian akhirnya

Satu hal yang membuat saya ingin memberikan komentar pada novel Daun yang Jatuh Tak Pernah Membenci Angin yaitu karakter Danar yang saya rasa kurang terlihat dan melekat di dalam cerita. Entahlah, mungkin karena di dalam novel ini, Tania seolah bercerita mengenai dirinya dan perasaan cintanya, juga ia menceritakan tokoh Danar dari sudut pandangnya.

Over all, saya sangat menikmati novel yang saya baca dalam waktu 3-4 jam ini, terlebih saya sangat menyukai tema percintaan beda usia."
91;"Novel Tere-Liye ini berhasil membuat aku pensaran setengah mati. Awalnya aku membacanya sudah sampai halaman 100 berapa gitu, dan jam sudah menunjukkan pukul 9 malam dan waktunya aku tidur. Tetapi aku tak bisa tidur dengan nyenyak karna memikirkan novel ini kelanjutannya seperti apa jadi aku terbangun saat jam menunjukkan pukul 3 subuh. Aku melanjutkan membacanya hingga jam setengah 6. Dan aku merasa perjuangan ku tidak sia-sia karna novel ini amat bagus.
Awalnya aku tahu tentang novel ini dari kakak aku yang bisa di bilang penggemar Tere-Liye. Dia sudah lama ingin membaca novel ini tetapi tidak kesampaian karna susah di cari di Gramedia Pontianak. Saat aku membaca sinopsisnya aku tertarik, karna sebelumnya aku sudah menonton film Hafalan Shalat Delisa yang dengan sukses membuat aku nangis bombay di bioskop.
Aku menyukai filmnya, dan jadilah aku bulan Maret lalu membeli novel ini di salah satu website buku online terbesar di Indonesia. Hem, sebenarnya bukan karna kakakku juga yang membuat aku penasaran dengan novel ini, teman ku di EKC juga bilang bajwa novel ini bagus dan aku juga telah membaca beberapa resensi novel ini di Google dan ternyata pendapat mereka hampir sama tentang novel ini.
Aku tidak akan membahas bagaimana jalan ceritanya, karna menurutku lebih baik membacanya sendiri saja. Buat aku novel ini bagus dan memberikan pelajaran bahwa jika manusia berusaha dengan giat maka dia akan berhasil di kemudian hari. Begitu juga dengan jalan hidup Tania yang dari seorang pengamen jalanan bisa sukses di negeri orang, yaitu di Singapura.
Ah, iya hampir lupa. Saat membaca awal-awal cerita, jujur saja aku sangat amat kesal sekali sama sosok Tania di cerita karna menurutku terlalu egois. Tapi jika aku berada di posisinya waktu masih kecil aku juga akan melakukan hal yang sama. Karna pola pikir anak kecil memang masih belum bisa di kendalikan karna mereka masih terlalu kecil untuk mengerti."
95;"Perasaan saat baca buku ini rasanya seperti kamu sedang naik roller coster dimana kereta kamu sedang menanjak dengan perlahan untuk menunggu, menunggu, dan menunggu sebelum akhirnya 'terjun bebas'.

Aku sempet berpikir aku telat 6 tahun baca buku ini. Tapi setelah di timbang2, aku baca buku ini di saat yang tepat. Bayangkan kalo aku baca novel ini 6 tahun yang lalu saat aku berumur 15 tahun, mungkin buku ini bakal langsung terlepas dari tangan aku dan gak berminat lagi bacanya. Kenapa? Karena buku ini membuat kita menunggu, menunggu, dan menunggu sebelum akhirnya 'terjun bebas'
Sama banget kaya roller coster, saat 'terjun bebas' itu, gak semua orang bisa menikmatinya. sesaat setelah terjun bebas pasti ada yang lega/plong dan ada juga yang trauma dengan itu. Mungkin diriku yang 6 tahun lalu bakalan trauma dengan buku ini, karena buku ini terlalu menyakitkan untuk di hadapi. Tapi seiring waktu, aku semakin besar dan otomatis pernah mengalami pahitnya hidup, aku jadi 'menolerir' genre semacam ini. Lets face it, hidup gak selalu indah kan :')
Bahkan cerita2 di buku dongeng2 sekalipun, tokohnya selalu mengalami hal pahit dulu.
Bedanya, ini bukan dongeng, ini hidup nyata dimana kenyataan tidak selalu sesuai dengan kenyataan.
Walaupun fiksi, setidaknya buku ini mengingatkan hal itu, gak semuanya berakhir happily ever after.

Endingnya? Pasti banyak pro dan kontra masalah ending. Aku gak akan spoiler kok, tapi menurut aku, ending nya adalah ending yang paling wise untuk kondisi para tokoh. Karena apapun yang keluar dari mulut kak danar (sang hero), tindakan yang di ambil tania (sang heroine) setelah itu adalah pilihan terbaik.

Terimakasih buat cerita yang amat, hm, apa ya? Bijaksana? Cocok kah kata itu?
Yah, kurang lebih semacam itulah :)
Terimakasih sudah membawa 'kereta roller coster' ke kamarku.
5 solid stars!!"
