No;Review
15;"""""""Buku tere liye ke sekian yang saya baca, tapi ini review pertama saya di goodreads :)
Jujur, dari beberapa buku tereliye yang saya baca sebelumnya, buku ini saya sebenarnya kurang suka sama ide ceritanya, yaitu anak sd yang suka sama om-om. ya, walaupun bukan berarti negatif. cuma masalah selera saja. namun saya tetap dapat menikmati buku ini dari awal sampai halaman terakhir.

Karena gaya cerita dari tereliye, sangat dapat dinikmati. Apalagi pada buku ini, alurnya flashback dan caranya menceritakan kenangan si Tania itu, mantap. Juga, kata-kata ajaib dari tere liye di buku ini membuat saya selalu ingin membaca halaman berikutnya (bahkan ketika telah mencapai halaman terakhir)


ini kutipan favorit,yang saya buat artworknya disini : 
“Kebaikan itu seperti pesawat terbang, Tania. Jendela-jendela bergetar, layar teve bergoyang, telepon genggam terinduksi saat pesawat itu lewat. Kebaikan merambat tanpa mengenal batas. Bagai garpu tala yang beresonansi, kebaikan menyebar dengan cepat “""""
""
"
