No;Review
18;"""""""Saya harus akui Tere Liye memang bukan sembarang penulis. Kalimat-kalimat tokoh utama dalam novel ini sempat membuat saya menangis. Apalagi kalimat sang ibu saat meninggal dan kalimat adik Tania, Dede yang berkunjung ke pusara ibu saat 8 tahun kepergian sang ibu.


Saya juga cukup menikmati kritik-kritik tersembunyi sang penulis tentang kondisi sosial yang berlangsung, melalui sang tokoh utama Tania.


Deskripsinya juga cukup oke, tempat-tempat sederhana, seperti warung makan tenda pinggir jalan atau toko buku jadi menarik karena dikemas dengan bahasa yang apik.

Tapi sayang, saya agak menyayangkan endingnya. Karena penggambaran tokoh Danar di akhir cerita samar. Saya gak tahu persis bagaimana perasaan si Danar. Tapi mungkin itu disengaja sama sang penulis untuk membuat pembacanya merasa sebal di akhir cerita.

Sebal? Bukan karena akhirnya gak happy ending, tapi karena akhirnya agak sedikit membingungkan buat saya. Haha.

At least, buku ini tetap menarik untuk dibaca kok :)""""
""
"
