No;Review
5;"""Semua masalah hati solusinya adalah hati kita sendiri. Dari buku ini saya belajar banyak tentang bagaimana manjadikan rasa cinta sebagai motivasi meraih prestasi,bagaimana menghadapi pahitnya kenyataan yang tak sesuai harapan, serta bagaimana memperlakukan kenangan.
Sosok Danar merupakan sosok impian. Seharusnya setiap orang menjadikannya sebagai cita-cita, dalam artian seharusnya setiap orang bercita-cita agar sukses seperti dirinya, agar berhati malaikat seperti dia. Kepeduliannya merupakan barang langka di zaman ini. Semoga pembaca buku ini menjadi Danar bagi dunia mereka masing-masing.
Tania. Tekad Tania untuk belajar keras agar merasa layak mendampingi Danar sangat patut dipuji. Meskipun akhirnya cintanya (sengaja) tak dibalas, namun prestasi yang diraihnya dalam masa-masa mengejar cinta itu abadi. Seperti inilah seharusnya orang jatuh cinta. Bukan membuang-buang waktu dengan hal-hal tidak berguna apalagi berdosa.
Meskipun bukan peran utama, Dede berhasil menunjukkan bagaimana seoarang anak seharusnya berkembang. Mulai dari yang kekanak-kanakan sampai menjadi teman curhat Tania. Bagaimana cara Danar mendidik Dede dan Tania juga merupakan contoh yang baik bagi orang tua untuk mendidik anak-anaknya.
Kekurangan buku ini mungkin pada sosok Danar yang terlalu bersifat malaikat. Sehingga kurang realistis di masa kini. Namun jika dilihat dari kaca idealis, (sekali lagi) sosok Danar adalah sosok yang harus kita wujudkan di dalam kehidupan kita.""
"
