No;Review
6;"""""""Seperti biasa, (Darwis) Tere Liye kembali menggencarkan hati dan marasuk pikiran. Banyak yang mungkin berkata bahwa mencintai orang yang jauh lebih tua daripadamu merupakan hal yang mustahil terjadi, cinta yang banyak menganggap, berdasar pada pedofilia atau lainnya. Tapi bagi saya, cinta ini sangat mungkin terjadi dan bukan sesuatu yang mengada-ngada. 

Ya, sedihnya, sangat amat sedih (dan seperti biasa Tere Liye lakukan), diakhiri dengan cerita menggantung. Seandainya Tere Liye bersedia melanjutkan kisahnya tentang akhir kisah mereka, niscaya akan banyak peminatnya. Bahkan dari novel ini saja (yang menggantung) merasuk pikiran para pembaca dan seketika selesai membaca, semua mencari dimanakah pohon linden itu hidup. Saya tahu itu sebab ketika saya selesai membaca dan membahasnya dengan salah satu teman saya, saya langsung mencari keberadaan pohon linden itu via google dan ketika saya mencarinya semua halaman yang saya cari pasti terdapat keywords judul novel tere-liye ini. (yap, mereka semua penasaran juga seperti saya)

Ah iya, mengganti id nama kala itu yang 'melebih-lebihkan' masih menjadi suatu tren ya? 

Dan ini bagian yang menurut saya paling menarik:
""""""""Bahwa hidup harus menerima...penerimaan yang indah. Bahwa hidup harus mengerti..pengertian yang benar. Bahwa hidup harus memahami.. pemahaman yang tulus. Tak peduli lewat apa penerimaan, pengertian, dan pemahaman itu datang. Tak masalah meski lewat kejadian yang sedih dan menyakitkan"""""""" halaman 196.""""
""
"
